{
  "id": "ui.visual-design",
  "version": "1.0.0",
  "engine": ">=0.1.0",
  "strategy": "deterministic",
  "offline": true,
  "deterministic": true,
  "category": "design/ui",
  "inputs": [
    "brief",
    "components",
    "data",
    "style"
  ],
  "outputs": [
    "visual-scene/1.0"
  ],
  "assets": [
    "ui.card",
    "ui.button",
    "ui.input"
  ],
  "capabilities": [
    "layout-v2",
    "text-layout",
    "charts-v2"
  ],
  "fallbacks": []
}
