{
  "id":"education.infographic",
  "version":"1.0.0",
  "engine":">=0.1.0",
  "strategy":"deterministic",
  "offline":true,
  "deterministic":true,
  "category":"education/editorial",
  "inputs":["brief","sections","exactText","visualHierarchy","style"],
  "outputs":["visual-scene/1.0"],
  "assets":["layout.card.educational","layout.grid.infographic"],
  "capabilities":["layout-v2","text-layout","quality-v2"],
  "fallbacks":[]
}